[
    {
        "id": 26366,
        "lat": 45.953020113006275,
        "lon": 13.43632087111473,
        "tags": {
            "brand": "Tamoil",
            "description": "Statale 56 Di Gorizia  Km. 21  Dir. Ovest 34071",
            "addr:postcode": "34071",
            "addr:city": "Cormons",
            "source:date": "2018-04-09"
        }
    },
    {
        "id": 11611,
        "lat": 45.95676739726052,
        "lon": 13.466316964626344,
        "tags": {
            "operator": "Servizi & Gestioni Italia S.R.L.",
            "brand": "Q8",
            "description": "V.Le V.Giulia Ss 356 Km 45+511 S/N 34071",
            "addr:postcode": "34071",
            "addr:city": "Cormons",
            "source:date": "2018-04-09"
        }
    },
    {
        "id": 21433,
        "lat": 45.95026200465828,
        "lon": 13.475195467472076,
        "tags": {
            "operator": "Zorgniotti & Piu Di Zorgniotti Oscar & C. S.A.S.",
            "brand": "Api-Ip",
            "description": "Statale 56 Di Gorizia  Km. 24  Dir. Gorizia 34071",
            "addr:postcode": "34071",
            "addr:city": "Cormons",
            "source:date": "2018-04-09"
        }
}
]
